{
  "brief": {
    "adapter": {
      "name": "sonic-buildimage",
      "rule_pack_sha": "92f7ba59f9aaab07",
      "version": "1.0"
    },
    "base_sha": "1e7ebe495c347916c733cbb205a9e087dda94937",
    "blob_cache_hits": 1615,
    "blobs_read": 466,
    "head_sha": "3589b565dff1229247826b9094529cf676a89c41",
    "id": "00000000-0000-4000-8000-000000024811",
    "measured_at": "2026-09-25T00:00:00Z",
    "mode": "range",
    "repo": "sonic-net/sonic-buildimage",
    "static_duration_s": 1.27,
    "status": "complete",
    "tree_paths": 17590
  },
  "budget": {
    "max_blob_reads": 30,
    "max_input_tokens": 120000,
    "max_tool_calls": 60
  },
  "coverage": {
    "affected": [
      "platform:arista/x86_64-arista_7050_qx32",
      "platform:arista/x86_64-arista_7050_qx32s",
      "platform:arista/x86_64-arista_7050cx3_32c",
      "platform:arista/x86_64-arista_7050cx3_32s",
      "platform:arista/x86_64-arista_7050dx4_32s",
      "platform:arista/x86_64-arista_7050px4_32s",
      "platform:arista/x86_64-arista_7050sx3_48c8",
      "platform:arista/x86_64-arista_7050sx3_48yc8",
      "platform:arista/x86_64-arista_7060_cx32s",
      "platform:arista/x86_64-arista_7060cx2_32s",
      "platform:arista/x86_64-arista_7060dx4_32",
      "platform:arista/x86_64-arista_7060dx5_32",
      "platform:arista/x86_64-arista_7060dx5_64s",
      "platform:arista/x86_64-arista_7060px4_32",
      "platform:arista/x86_64-arista_7060px5_64s",
      "platform:arista/x86_64-arista_7060x6_16pe_384c",
      "platform:arista/x86_64-arista_7060x6_16pe_384c_b",
      "platform:arista/x86_64-arista_7060x6_32pe",
      "platform:arista/x86_64-arista_7060x6_64de",
      "platform:arista/x86_64-arista_7060x6_64pe",
      "platform:arista/x86_64-arista_7060x6_64pe_b",
      "platform:arista/x86_64-arista_7170_32c",
      "platform:arista/x86_64-arista_7170_32cd",
      "platform:arista/x86_64-arista_7170_64c",
      "platform:arista/x86_64-arista_7170b_64c",
      "platform:arista/x86_64-arista_720dt_48s",
      "platform:arista/x86_64-arista_720dt_48s_mgx",
      "platform:arista/x86_64-arista_7260cx3_64",
      "platform:arista/x86_64-arista_7280cr3_32d4",
      "platform:arista/x86_64-arista_7280cr3_32p4",
      "platform:arista/x86_64-arista_7280cr3mk_32d4",
      "platform:arista/x86_64-arista_7280cr3mk_32p4",
      "platform:arista/x86_64-arista_7280dr3a_36",
      "platform:arista/x86_64-arista_7280dr3ak_36",
      "platform:arista/x86_64-arista_7280dr3ak_36s",
      "platform:arista/x86_64-arista_7280dr3am_36",
      "platform:arista/x86_64-arista_7280r4_32qf_32df",
      "platform:arista/x86_64-arista_7280r4k_32qf_32df"
    ],
    "aliased_as_platform": [
      "arista/x86_64-arista_7280cr3k_32d4",
      "arista/x86_64-arista_7280cr3k_32p4",
      "barefoot/x86_64-accton_as9516bf_32d-r0"
    ],
    "aliased_platforms": 3,
    "ambiguous": [],
    "covered": [
      "platform:arista/x86_64-arista_7050_qx32",
      "platform:arista/x86_64-arista_7050_qx32s",
      "platform:arista/x86_64-arista_7050cx3_32c",
      "platform:arista/x86_64-arista_7050cx3_32s",
      "platform:arista/x86_64-arista_7050dx4_32s",
      "platform:arista/x86_64-arista_7050px4_32s",
      "platform:arista/x86_64-arista_7050sx3_48c8",
      "platform:arista/x86_64-arista_7050sx3_48yc8",
      "platform:arista/x86_64-arista_7060_cx32s",
      "platform:arista/x86_64-arista_7060cx2_32s",
      "platform:arista/x86_64-arista_7060dx4_32",
      "platform:arista/x86_64-arista_7060dx5_32",
      "platform:arista/x86_64-arista_7060dx5_64s",
      "platform:arista/x86_64-arista_7060px4_32",
      "platform:arista/x86_64-arista_7060px5_64s",
      "platform:arista/x86_64-arista_7060x6_16pe_384c",
      "platform:arista/x86_64-arista_7060x6_16pe_384c_b",
      "platform:arista/x86_64-arista_7060x6_32pe",
      "platform:arista/x86_64-arista_7060x6_64de",
      "platform:arista/x86_64-arista_7060x6_64pe",
      "platform:arista/x86_64-arista_7060x6_64pe_b",
      "platform:arista/x86_64-arista_720dt_48s",
      "platform:arista/x86_64-arista_720dt_48s_mgx",
      "platform:arista/x86_64-arista_7260cx3_64"
    ],
    "declarations_in_tree": 260,
    "excluded_as_non_platform": [
      "device/arista/x86_64-arista_common",
      "device/broadcom/x86_64-broadcom_common"
    ],
    "job_group_names": [
      "broadcom",
      "marvell-prestera-arm64",
      "marvell-prestera-armhf",
      "mellanox",
      "vs"
    ],
    "job_groups": 5,
    "kept_without_hwsku": 24,
    "model": "pr-build-stage",
    "multi_family_declarations": 1,
    "parse": {
      "limitations": [],
      "loose_scan_agrees": true,
      "loose_scan_names": [
        "broadcom",
        "marvell-prestera-arm64",
        "marvell-prestera-armhf",
        "mellanox",
        "vs"
      ],
      "scope": "Build+BuildVS",
      "strict": true,
      "templates_read": [
        ".azure-pipelines/azure-pipelines-build.yml",
        ".azure-pipelines/azure-pipelines-image-template.yml",
        ".azure-pipelines/azure-pipelines-job-groups.yml"
      ]
    },
    "platforms_in_tree": 261,
    "symlinked_declarations": 17,
    "uncovered": [
      "platform:arista/x86_64-arista_7170_32c",
      "platform:arista/x86_64-arista_7170_32cd",
      "platform:arista/x86_64-arista_7170_64c",
      "platform:arista/x86_64-arista_7170b_64c",
      "platform:arista/x86_64-arista_7280cr3_32d4",
      "platform:arista/x86_64-arista_7280cr3_32p4",
      "platform:arista/x86_64-arista_7280cr3mk_32d4",
      "platform:arista/x86_64-arista_7280cr3mk_32p4",
      "platform:arista/x86_64-arista_7280dr3a_36",
      "platform:arista/x86_64-arista_7280dr3ak_36",
      "platform:arista/x86_64-arista_7280dr3ak_36s",
      "platform:arista/x86_64-arista_7280dr3am_36",
      "platform:arista/x86_64-arista_7280r4_32qf_32df",
      "platform:arista/x86_64-arista_7280r4k_32qf_32df"
    ],
    "unresolved_declarations": 0
  },
  "entities": [
    {
      "id": "asic_family:barefoot",
      "kind": "asic_family",
      "members": 14,
      "resolved_via": "blob",
      "source": "device/arista/x86_64-arista_7170_32c/platform_asic"
    },
    {
      "id": "asic_family:broadcom",
      "kind": "asic_family",
      "members": 145,
      "resolved_via": "blob",
      "source": "device/arista/x86_64-arista_7050_qx32/platform_asic"
    },
    {
      "id": "asic_family:broadcom-dnx",
      "kind": "asic_family",
      "members": 26,
      "resolved_via": "blob",
      "source": "device/arista/x86_64-arista_7280cr3_32p4/platform_asic"
    },
    {
      "id": "asic_family:marvell-prestera",
      "kind": "asic_family",
      "members": 10,
      "resolved_via": "blob",
      "source": "azure-pipelines.yml"
    },
    {
      "arch": "amd64",
      "family": "broadcom",
      "id": "ci_job_group:broadcom",
      "kind": "ci_job_group",
      "members": 145,
      "resolved_via": "blob",
      "source": "azure-pipelines.yml"
    },
    {
      "arch": "arm64",
      "family": "marvell-prestera",
      "id": "ci_job_group:marvell-prestera-arm64",
      "kind": "ci_job_group",
      "members": 0,
      "resolved_via": "blob",
      "source": "azure-pipelines.yml"
    },
    {
      "arch": "armhf",
      "family": "marvell-prestera",
      "id": "ci_job_group:marvell-prestera-armhf",
      "kind": "ci_job_group",
      "members": 0,
      "resolved_via": "blob",
      "source": "azure-pipelines.yml"
    },
    {
      "arch": "amd64",
      "family": "mellanox",
      "id": "ci_job_group:mellanox",
      "kind": "ci_job_group",
      "members": 32,
      "resolved_via": "blob",
      "source": "azure-pipelines.yml"
    },
    {
      "arch": "amd64",
      "family": "vs",
      "id": "ci_job_group:vs",
      "kind": "ci_job_group",
      "members": 2,
      "resolved_via": "blob",
      "source": "azure-pipelines.yml"
    },
    {
      "arch": "amd64",
      "id": "platform:arista/x86_64-arista_7050_qx32",
      "kind": "platform",
      "members": 1,
      "resolved_via": "blob",
      "source": "device/arista/x86_64-arista_7050_qx32/platform_asic"
    },
    {
      "arch": "amd64",
      "id": "platform:arista/x86_64-arista_7050_qx32s",
      "kind": "platform",
      "members": 1,
      "resolved_via": "blob",
      "source": "device/arista/x86_64-arista_7050_qx32s/platform_asic"
    },
    {
      "arch": "amd64",
      "id": "platform:arista/x86_64-arista_7050cx3_32c",
      "kind": "platform",
      "members": 1,
      "resolved_via": "symlink",
      "source": "device/arista/x86_64-arista_7050cx3_32c/platform_asic"
    },
    {
      "arch": "amd64",
      "id": "platform:arista/x86_64-arista_7050cx3_32s",
      "kind": "platform",
      "members": 1,
      "resolved_via": "blob",
      "source": "device/arista/x86_64-arista_7050cx3_32s/platform_asic"
    },
    {
      "arch": "amd64",
      "id": "platform:arista/x86_64-arista_7050dx4_32s",
      "kind": "platform",
      "members": 1,
      "resolved_via": "blob",
      "source": "device/arista/x86_64-arista_7050dx4_32s/platform_asic"
    },
    {
      "arch": "amd64",
      "id": "platform:arista/x86_64-arista_7050px4_32s",
      "kind": "platform",
      "members": 1,
      "resolved_via": "blob",
      "source": "device/arista/x86_64-arista_7050px4_32s/platform_asic"
    },
    {
      "arch": "amd64",
      "id": "platform:arista/x86_64-arista_7050sx3_48c8",
      "kind": "platform",
      "members": 1,
      "resolved_via": "blob",
      "source": "device/arista/x86_64-arista_7050sx3_48c8/platform_asic"
    },
    {
      "arch": "amd64",
      "id": "platform:arista/x86_64-arista_7050sx3_48yc8",
      "kind": "platform",
      "members": 1,
      "resolved_via": "blob",
      "source": "device/arista/x86_64-arista_7050sx3_48yc8/platform_asic"
    },
    {
      "arch": "amd64",
      "id": "platform:arista/x86_64-arista_7060_cx32s",
      "kind": "platform",
      "members": 1,
      "resolved_via": "blob",
      "source": "device/arista/x86_64-arista_7060_cx32s/platform_asic"